{"$schema":"https://json-schema.org/draft/2020-12/schema","$id":"https://schemas.rotprods.dev/clever/v1/event.schema.json","type":"object","additionalProperties":false,"required":["contractVersion","messageId","correlationId","causationId","occurredAt","producer","principal","classification","eventType","payload"],"properties":{"contractVersion":{"$ref":"https://schemas.rotprods.dev/clever/v1/common.schema.json#/$defs/contractVersion"},"messageId":{"type":"string","minLength":1},"correlationId":{"type":"string","minLength":1},"causationId":{"type":"string","minLength":1},"occurredAt":{"$ref":"https://schemas.rotprods.dev/clever/v1/common.schema.json#/$defs/timestamp"},"producer":{"$ref":"https://schemas.rotprods.dev/clever/v1/common.schema.json#/$defs/runtimeOwner"},"principal":{"$ref":"https://schemas.rotprods.dev/clever/v1/common.schema.json#/$defs/principalRef"},"sessionId":{"type":"string"},"goalId":{"type":"string"},"classification":{"$ref":"https://schemas.rotprods.dev/clever/v1/common.schema.json#/$defs/classification"},"eventType":{"type":"string","minLength":1},"payload":{"$ref":"https://schemas.rotprods.dev/clever/v1/common.schema.json#/$defs/payload"},"provenance":{"type":"array","items":{"$ref":"https://schemas.rotprods.dev/clever/v1/common.schema.json#/$defs/provenanceRef"}},"evidence":{"type":"array","items":{"$ref":"https://schemas.rotprods.dev/clever/v1/common.schema.json#/$defs/evidenceRef"}}}}
