{"contractVersion":{"major":1,"minor":0},"messageId":"evt_demo","correlationId":"corr_demo","causationId":"root_demo","occurredAt":"2026-09-01T00:00:00Z","producer":{"runtimeId":"clicky-macos","adapterId":"clicky"},"principal":{"userId":"user_demo","deviceId":"mac_demo"},"sessionId":"ses_demo","goalId":"goal_demo","classification":"DATA_CLASSIFICATION_SENSITIVE","eventType":"screen.observed","payload":{"schemaUri":"clever://perception/screen/v1","contentType":"application/json","data":"e30="},"provenance":[{"sourceRepo":"farzaa/clicky","sourceCommit":"a80fa80721a8aebe51a170a7780705024ebc6e46","sourcePath":"leanring-buddy/CompanionManager.swift"}],"evidence":[{"evidenceId":"EVID-DEMO"}]}
